{
  "distributions": [
    {
      "id": "example/demo",
      "kind": "upstream",
      "packager": "example",
      "product_id": "demo",
      "release_policies": [
        {
          "current_evidence": [
            "schema-demo",
            "runtime-demo-codex",
            "materialization-demo-codex",
            "materialization-demo-cursor"
          ],
          "minimum_installer_version": "0.1.6",
          "release_sequence": 2,
          "status": "active",
          "targets": [
            {
              "client": "codex",
              "authentication": "not_required",
              "delivery": "managed",
              "scopes": [
                "user"
              ]
            },
            {
              "client": "cursor",
              "authentication": "required",
              "delivery": "managed",
              "scopes": [
                "user"
              ]
            }
          ]
        }
      ],
      "releases": [
        {
          "agent_plugins_schema": "https://agent-plugins.org/schemas/1.0.0/plugin.schema.json",
          "components": [
            "mcp"
          ],
          "manifest_digest": "sha256:2222222222222222222222222222222222222222222222222222222222222222",
          "manifest_name": "demo",
          "package_source": {
            "path": "plugins/demo",
            "repository": "example/plugins",
            "revision": "aaaaaaaaaaaaaaaaaaaaaaaaaaaaaaaaaaaaaaaa"
          },
          "package_version": "1.0.0",
          "published_at": "2026-08-20T00:00:00Z",
          "sequence": 2,
          "tree_digest": "sha256:1111111111111111111111111111111111111111111111111111111111111111",
          "tree_digest_algorithm": "uap-tree-sha256-v1"
        }
      ],
      "schema_version": 1,
      "status": "active"
    },
    {
      "id": "example/demo-bridge",
      "kind": "community_bridge",
      "packager": "example",
      "product_id": "demo",
      "release_policies": [
        {
          "current_evidence": [],
          "minimum_installer_version": "0.1.6",
          "release_sequence": 1,
          "status": "active",
          "targets": [
            {
              "client": "codex",
              "authentication": "unknown",
              "scopes": [
                "user"
              ],
              "delivery": "managed"
            },
            {
              "client": "cursor",
              "authentication": "not_required",
              "scopes": [
                "user"
              ],
              "delivery": "managed"
            },
            {
              "client": "kiro",
              "authentication": "not_required",
              "scopes": [
                "user"
              ],
              "delivery": "managed"
            }
          ]
        }
      ],
      "releases": [
        {
          "agent_plugins_schema": "https://agent-plugins.org/schemas/1.0.0/plugin.schema.json",
          "build_provenance": {
            "upstream_repository": "example/plugins",
            "upstream_revision": "cccccccccccccccccccccccccccccccccccccccc"
          },
          "components": [
            "mcp"
          ],
          "manifest_digest": "sha256:5555555555555555555555555555555555555555555555555555555555555555",
          "manifest_name": "demo",
          "package_source": {
            "path": "plugins/demo",
            "repository": "example/bridge",
            "revision": "bbbbbbbbbbbbbbbbbbbbbbbbbbbbbbbbbbbbbbbb"
          },
          "package_version": "0.9.0",
          "published_at": "2026-08-20T00:00:00Z",
          "sequence": 1,
          "tree_digest": "sha256:4444444444444444444444444444444444444444444444444444444444444444",
          "tree_digest_algorithm": "uap-tree-sha256-v1"
        }
      ],
      "schema_version": 1,
      "status": "active"
    }
  ],
  "evidence": [
    {
      "artifact": {
        "digest": "sha256:6666666666666666666666666666666666666666666666666666666666666666",
        "path": "evidence/demo-schema.json",
        "repository": "example/evidence",
        "revision": "ffffffffffffffffffffffffffffffffffffffff"
      },
      "distribution_id": "example/demo",
      "id": "schema-demo",
      "level": "schema",
      "outcome": "passed",
      "package_tree_digest": "sha256:1111111111111111111111111111111111111111111111111111111111111111",
    "release_sequence": 2,
    "schema_version": 1,
    "trust": {
      "kind": "github_actions",
      "source_digest": "ffffffffffffffffffffffffffffffffffffffff",
      "source_ref": "refs/heads/main",
      "workflow": "example/evidence/.github/workflows/evidence.yml"
    }
    },
    {
      "architecture": "amd64",
      "artifact": {
        "digest": "sha256:3333333333333333333333333333333333333333333333333333333333333333",
        "path": "evidence/demo.json",
        "repository": "example/evidence",
        "revision": "eeeeeeeeeeeeeeeeeeeeeeeeeeeeeeeeeeeeeeee"
      },
      "client": "codex",
      "client_version": "0.200.0",
      "distribution_id": "example/demo",
      "id": "runtime-demo-codex",
      "installer_version": "0.1.6",
      "level": "runtime",
      "observed_at": "2026-08-19T00:00:00Z",
      "os": "linux",
      "outcome": "passed",
      "package_tree_digest": "sha256:1111111111111111111111111111111111111111111111111111111111111111",
    "release_sequence": 2,
    "schema_version": 1,
    "trust": {
      "kind": "reviewed_external"
    }
    },
    {
      "architecture": "amd64",
      "artifact": { "digest": "sha256:7777777777777777777777777777777777777777777777777777777777777777", "path": "evidence/demo-codex-materialization.json", "repository": "example/evidence", "revision": "7777777777777777777777777777777777777777" },
      "client": "codex", "client_version": "0.200.0", "distribution_id": "example/demo", "id": "materialization-demo-codex", "installer_version": "0.1.6", "level": "materialization", "observed_at": "2026-08-19T00:00:00Z", "os": "linux", "outcome": "passed", "package_tree_digest": "sha256:1111111111111111111111111111111111111111111111111111111111111111", "release_sequence": 2, "schema_version": 1,
      "trust": {"kind": "github_actions", "workflow": "example/evidence/.github/workflows/evidence.yml", "source_ref": "refs/heads/main", "source_digest": "7777777777777777777777777777777777777777"}
    },
    {
      "architecture": "amd64",
      "artifact": { "digest": "sha256:8888888888888888888888888888888888888888888888888888888888888888", "path": "evidence/demo-cursor-materialization.json", "repository": "example/evidence", "revision": "8888888888888888888888888888888888888888" },
      "client": "cursor", "client_version": "1.0.0", "distribution_id": "example/demo", "id": "materialization-demo-cursor", "installer_version": "0.1.6", "level": "materialization", "observed_at": "2026-08-19T00:00:00Z", "os": "linux", "outcome": "passed", "package_tree_digest": "sha256:1111111111111111111111111111111111111111111111111111111111111111", "release_sequence": 2, "schema_version": 1,
      "trust": {"kind": "github_actions", "workflow": "example/evidence/.github/workflows/evidence.yml", "source_ref": "refs/heads/main", "source_digest": "8888888888888888888888888888888888888888"}
    }
  ],
  "expires_at": "2026-09-19T00:00:00Z",
  "generated_at": "2026-08-20T00:00:00Z",
  "products": [
    {
      "aliases": [
        "demo"
      ],
      "categories": [
        "demo"
      ],
      "default_distribution": "example/demo",
      "description": "Fixture product with multiple distributions.",
      "display_name": "Demo",
      "distributions": [
        "example/demo",
        "example/demo-bridge"
      ],
      "id": "demo",
      "manifest_name": "demo",
      "minimum_capabilities": {
        "mcp": "required",
        "skills": "optional"
      },
      "reserved_aliases": [
        "demo"
      ],
      "schema_version": 1
    }
  ],
  "publication_id": "site-fixture",
  "revocations": [],
  "sequence": 42,
  "snapshot_schema_version": 1,
  "source_commit": "dddddddddddddddddddddddddddddddddddddddd"
}
